{
  "schema_version": "1.0",
  "generated_at": "2026-01-30T02:29:03.890408+00:00",
  "total_segments": 3071,
  "total_chunks": 7,
  "chunk_size": 500,
  "duration_ms": 18231500,
  "speakers": {
    "count": 50,
    "list": [
      "Alex Rivera",
      "David Kim",
      "Diana Martinez",
      "Emily Zhang",
      "Employee Eight",
      "Employee Eighteen",
      "Employee Eleven",
      "Employee Fifteen",
      "Employee Five",
      "Employee Four",
      "Employee Fourteen",
      "Employee Nine",
      "Employee Nineteen",
      "Employee Seven",
      "Employee Seventeen",
      "Employee Six",
      "Employee Sixteen",
      "Employee Ten",
      "Employee Thirteen",
      "Employee Thirty",
      "Employee Thirty One",
      "Employee Twelve",
      "Employee Twenty",
      "Employee Twenty Eight",
      "Employee Twenty Five",
      "Employee Twenty Four",
      "Employee Twenty Nine",
      "Employee Twenty One",
      "Employee Twenty Seven",
      "Employee Twenty Six",
      "Employee Twenty Three",
      "Employee Twenty Two",
      "James Wilson",
      "Jennifer Adams",
      "Jordan Lee",
      "Kevin Marketing VP",
      "Kevin Morrison",
      "Kevin O'Brien",
      "Linda Chen",
      "Lisa Chen",
      "Lisa Park",
      "Marcus Thompson",
      "Margaret Evans",
      "Maria Chen",
      "Michelle Taylor",
      "Priya Sharma",
      "Robert Chen",
      "Sam Kim",
      "Sarah Mitchell",
      "Tom Williams"
    ],
    "segment_counts": {
      "Robert Chen": 1005,
      "Diana Martinez": 491,
      "James Wilson": 258,
      "Jennifer Adams": 317,
      "Michelle Taylor": 309,
      "Kevin O'Brien": 136,
      "Alex Rivera": 20,
      "Sam Kim": 17,
      "Jordan Lee": 17,
      "Kevin Marketing VP": 27,
      "Sarah Mitchell": 163,
      "Maria Chen": 8,
      "Tom Williams": 8,
      "Lisa Park": 8,
      "Employee Four": 1,
      "Employee Five": 1,
      "Linda Chen": 149,
      "Kevin Morrison": 59,
      "Employee Six": 1,
      "Employee Seven": 1,
      "Employee Eight": 1,
      "Employee Nine": 1,
      "Employee Ten": 1,
      "Employee Eleven": 1,
      "Employee Twelve": 1,
      "Employee Thirteen": 1,
      "Employee Fourteen": 1,
      "Employee Fifteen": 1,
      "Employee Sixteen": 1,
      "Margaret Evans": 25,
      "Employee Seventeen": 1,
      "Employee Eighteen": 1,
      "Employee Nineteen": 1,
      "Employee Twenty": 1,
      "Employee Twenty One": 1,
      "Employee Twenty Two": 1,
      "Employee Twenty Three": 1,
      "Employee Twenty Four": 1,
      "Employee Twenty Five": 1,
      "Employee Twenty Six": 1,
      "Employee Twenty Seven": 1,
      "Employee Twenty Eight": 1,
      "Emily Zhang": 6,
      "Marcus Thompson": 5,
      "Priya Sharma": 5,
      "David Kim": 5,
      "Lisa Chen": 5,
      "Employee Twenty Nine": 1,
      "Employee Thirty": 1,
      "Employee Thirty One": 1
    }
  },
  "chunks": [
    {
      "chunk_id": "chunk-001",
      "segment_range": [
        1,
        500
      ],
      "timestamp_range": {
        "start_ms": 0,
        "end_ms": 2750000
      },
      "speaker_counts": {
        "Robert Chen": 136,
        "Diana Martinez": 109,
        "James Wilson": 67,
        "Jennifer Adams": 60,
        "Michelle Taylor": 60,
        "Kevin O'Brien": 37,
        "Alex Rivera": 13,
        "Sam Kim": 8,
        "Jordan Lee": 10
      },
      "word_count": 6396,
      "file": "chunks/chunk-001.json"
    },
    {
      "chunk_id": "chunk-002",
      "segment_range": [
        501,
        1000
      ],
      "timestamp_range": {
        "start_ms": 2750000,
        "end_ms": 5541500
      },
      "speaker_counts": {
        "James Wilson": 30,
        "Robert Chen": 154,
        "Jennifer Adams": 58,
        "Michelle Taylor": 70,
        "Kevin O'Brien": 57,
        "Diana Martinez": 85,
        "Jordan Lee": 6,
        "Sam Kim": 8,
        "Kevin Marketing VP": 27,
        "Alex Rivera": 5
      },
      "word_count": 5256,
      "file": "chunks/chunk-002.json"
    },
    {
      "chunk_id": "chunk-003",
      "segment_range": [
        1001,
        1500
      ],
      "timestamp_range": {
        "start_ms": 5542000,
        "end_ms": 8549500
      },
      "speaker_counts": {
        "Diana Martinez": 79,
        "James Wilson": 49,
        "Jennifer Adams": 62,
        "Michelle Taylor": 51,
        "Robert Chen": 117,
        "Sarah Mitchell": 56,
        "Maria Chen": 8,
        "Tom Williams": 8,
        "Lisa Park": 8,
        "Alex Rivera": 2,
        "Sam Kim": 1,
        "Jordan Lee": 1,
        "Employee Four": 1,
        "Employee Five": 1,
        "Kevin O'Brien": 4,
        "Linda Chen": 25,
        "Kevin Morrison": 27
      },
      "word_count": 5205,
      "file": "chunks/chunk-003.json"
    },
    {
      "chunk_id": "chunk-004",
      "segment_range": [
        1501,
        2000
      ],
      "timestamp_range": {
        "start_ms": 8550000,
        "end_ms": 11603500
      },
      "speaker_counts": {
        "Diana Martinez": 63,
        "Employee Six": 1,
        "Robert Chen": 208,
        "Sarah Mitchell": 26,
        "Employee Seven": 1,
        "Employee Eight": 1,
        "Employee Nine": 1,
        "Jennifer Adams": 62,
        "James Wilson": 51,
        "Employee Ten": 1,
        "Employee Eleven": 1,
        "Employee Twelve": 1,
        "Employee Thirteen": 1,
        "Michelle Taylor": 30,
        "Linda Chen": 26,
        "Kevin O'Brien": 26
      },
      "word_count": 4061,
      "file": "chunks/chunk-004.json"
    },
    {
      "chunk_id": "chunk-005",
      "segment_range": [
        2001,
        2500
      ],
      "timestamp_range": {
        "start_ms": 11604000,
        "end_ms": 14705500
      },
      "speaker_counts": {
        "Sarah Mitchell": 56,
        "Employee Fourteen": 1,
        "Diana Martinez": 91,
        "Employee Fifteen": 1,
        "Employee Sixteen": 1,
        "Robert Chen": 138,
        "Margaret Evans": 25,
        "Linda Chen": 42,
        "Jennifer Adams": 45,
        "James Wilson": 32,
        "Michelle Taylor": 32,
        "Kevin Morrison": 32,
        "Employee Seventeen": 1,
        "Employee Eighteen": 1,
        "Employee Nineteen": 1,
        "Employee Twenty": 1
      },
      "word_count": 3771,
      "file": "chunks/chunk-005.json"
    },
    {
      "chunk_id": "chunk-006",
      "segment_range": [
        2501,
        3000
      ],
      "timestamp_range": {
        "start_ms": 14706000,
        "end_ms": 17805500
      },
      "speaker_counts": {
        "Diana Martinez": 42,
        "Michelle Taylor": 66,
        "Robert Chen": 217,
        "Jennifer Adams": 30,
        "Employee Twenty One": 1,
        "Employee Twenty Two": 1,
        "Employee Twenty Three": 1,
        "Kevin O'Brien": 12,
        "Employee Twenty Four": 1,
        "Linda Chen": 52,
        "James Wilson": 29,
        "Employee Twenty Five": 1,
        "Sarah Mitchell": 18,
        "Employee Twenty Six": 1,
        "Employee Twenty Seven": 1,
        "Employee Twenty Eight": 1,
        "Emily Zhang": 6,
        "Marcus Thompson": 5,
        "Priya Sharma": 5,
        "David Kim": 5,
        "Lisa Chen": 5
      },
      "word_count": 3572,
      "file": "chunks/chunk-006.json"
    },
    {
      "chunk_id": "chunk-007",
      "segment_range": [
        3001,
        3071
      ],
      "timestamp_range": {
        "start_ms": 17806000,
        "end_ms": 18231500
      },
      "speaker_counts": {
        "Linda Chen": 4,
        "Diana Martinez": 22,
        "Employee Twenty Nine": 1,
        "Sarah Mitchell": 7,
        "Employee Thirty": 1,
        "Robert Chen": 35,
        "Employee Thirty One": 1
      },
      "word_count": 535,
      "file": "chunks/chunk-007.json"
    }
  ]
}
